Product Name,Category,Ingredients,Short Description (AI),Macronutrient Breakdown (AI),Proteins,Fats,Carbs,Nutritional Sheet (AI),Storage,Shelf Life (days),Storage & Handling Advice,Producer,Description,Unit of Sale,Price,Production Method,Main Photo,Price per Day of Shelf Life,Producer Type
Smen,Cheeses & Dairy,"Butter,Salt","Traditional Moroccan smen—aged, salted butter with a rich, tangy flavor—perfect for enhancing couscous, tagines, and authentic North African dishes.","Proteins 1%  
Lipids 99%  
Carbs 0%",1,99,0,"Energy: 720 kcal, Protein: 0.5 g, Carbohydrates: 1 g, Fat: 80 g, Fiber: 0 g, Sodium: 1500 mg",Refrigerated,365,Store butter tightly wrapped in its original packaging or an airtight container in the coldest part of the refrigerator and use within 12 months; ensure minimal exposure to air and strong odors to preserve flavor and prevent spoilage.,,,,,,image.png (https://v5.airtableusercontent.com/v3/u/53/53/1780365600000/NNd_z_ybagp3t4BGcpy_IQ/c-8zZvDgkQp_-U89CqqQHyCMuVhnuBGdeaah5C0u-znM3cL4vjLnvJzQLvwMpmm37FSIjZaw-PD3-Z_BCrS8ZCY6S79m_P90zyObBmwFaTe3F3ORgQVfSJybX_0qfMTqD2kcBfcMXK10R742GekkRg/M-n91Gwatq2cRLq0jBol8ZXZbClaEEyS_BWrNCBLT68),0,
Marinated Olives,Fermented Vegetables,"Fresh olives,Salt,Water,Lemon,Garlic,Bay leaf,Chili pepper,Olive oil","Zesty marinated olives infused with lemon, garlic, bay leaf, and chili pepper—an irresistible Mediterranean snack or appetizer bursting with bold, savory flavor.","Proteins 2%  
Lipids 85%  
Carbs 13%",2,85,13,"Energy: 210 kcal, Protein: 1.2 g, Carbohydrates: 6 g, Fat: 21 g, Fiber: 3 g, Sodium: 1200 mg",Room Temp,180,"Store in a cool, dry place away from direct sunlight, ensuring the container is tightly sealed to maintain quality and prevent spoilage throughout the 180-day shelf life. For fermented olives, avoid temperature fluctuations and use clean utensils to prevent contamination.",,,,,,image.png (https://v5.airtableusercontent.com/v3/u/53/53/1780365600000/NkB7-HKKBIpxGMQ-xujXWg/jcI99rjC-BFLl2aUdBN_Cqp3y1Qecp_w9XVB6HwtN0BM489Xfd1Gc5PDlI7w0f_mEQvZlUAAev1JRCDkbgriki4Qw2-pUH3zT_jvV1zh0msZCHjWq6zI4qvY-fDcZ_fXE36gZMhpHA7DYogb-ZvvZw/UnuPutyKV-EvF6qhTFTH00x91k7RvWucHIIGBz3ounI),0,
Mayonnaise,Sauces & Condiments,"Eggs,Olive oil,Mustard,Salt","Creamy mayonnaise made with rich eggs, premium olive oil, and zesty mustard—perfect for elevating sandwiches, salads, and dips with gourmet flavor.","Proteins 1%  
Lipids 80%  
Carbs 19%",1,80,19,"Energy: 700 kcal, Protein: 2 g, Carbohydrates: 1 g, Fat: 76 g, Fiber: 0 g, Vitamin E: 15 mg",Refrigerated,90,"Store refrigerated at or below 4°C and keep tightly sealed; consume within 90 days to maintain quality and prevent spoilage, as this egg-based sauce is susceptible to bacterial growth if temperature control is compromised.",,,,,,image.png (https://v5.airtableusercontent.com/v3/u/53/53/1780365600000/vLhVOqms9lk058gKKZISaA/DeQoJNdzaYZ06j-Ps6qpia4Xa_4ACrRyjPxapEnQQMxyTbdLmtdSSvyf69stbwUlYuP3xeIK5ksz6s_MAaKCjPixHhSN8SIJqu6ia6wAUXavkI_PMZ_D3t0c7nAyVTQjiKPi2r9RRooqbAy_xQUZGA/57aLhpwZlB63ASJxCG3mt-RI79zVMYt6WgiXIABjGrQ),0,
Pistachio Butter,Spreads & Nut Butters,"Pistachios,Olive/Argan oil,Honey","Creamy pistachio butter blended with olive or argan oil and a touch of honey for a naturally sweet, nutrient-rich spread.","Proteins 20%  
Lipids 70%  
Carbs 10%",20,70,10,"Energy: 600 kcal, Protein: 18 g, Carbohydrates: 20 g, Fat: 52 g, Fiber: 8 g, Vitamin E: 6 mg",Room Temp,180,"Store in a cool, dry place away from direct sunlight and tightly seal after each use to preserve freshness and prevent oil rancidity over the 180-day shelf life.",,,,,,image.png (https://v5.airtableusercontent.com/v3/u/53/53/1780365600000/-9JutoARCrSYbK_9237DMg/T6O9s852E1VM9tbU90qUwRU5_hyzNvz5-qq0gKIJa8TkIo6syDIo8WW44bsUxbwHANQk-2PeK6MUw_X6_244QlkwIVSUI25Pq8WPSCaoWZlPdgX1MNlLGl-Yx226zdcN-6m0QsJojfGihhPntHMJcA/j0FSk7PTk-v6HRaeD6FeWUJ1XK4DbQ5FbA4PyT8fmNQ),0,
Amlou,Spreads & Nut Butters,"Almonds,Argan oil,Honey","Rich and creamy Amlou blends roasted almonds, pure argan oil, and honey for a naturally sweet, nutritious spread perfect for breakfast or snacking.","Proteins 10%  
Lipids 60%  
Carbs 30%",10,60,30,"Energy: 570 kcal, Protein: 13 g, Carbohydrates: 25 g, Fat: 45 g, Fiber: 7 g, Vitamin E: 20 mg",Room Temp,180,"Store in a cool, dry place away from direct sunlight and tightly seal after each use to preserve freshness and prevent oil separation over the 180-day shelf life.",,,,,,image.png (https://v5.airtableusercontent.com/v3/u/53/53/1780365600000/I5pEs6oPV9rqMUNLj-jVaQ/SEJQmS9d9VciiUXLHnTshIrNYoPK1ekLzLO41PideyKPgSaiNjgtT01gqtT1BNBuIz4-vEV4MCWzezrLa6NyZ_fVdGDNuiCkDOnrvMDnveZIYJapZnrofhVp-3P6U8Anfh0iFhUJDqGv-cirP6WnXQ/9Fd-_sDP0OzjQHFDvpnz2SyVUyF50-W_1R_GW1lURbI),0,
Pumpkin Seed Butter,Spreads & Nut Butters,"Pumpkin seeds,Olive/Argan oil,Honey","Creamy pumpkin seed butter blended with olive and argan oils, lightly sweetened with honey for a nutritious, nutty spread packed with natural goodness.","Proteins 25%  
Lipids 55%  
Carbs 20%",25,55,20,"Energy: 600 kcal, Protein: 25 g, Carbohydrates: 15 g, Fat: 50 g, Fiber: 6 g, Magnesium: 400 mg",Room Temp,180,"Store in a cool, dry place away from direct sunlight and tightly seal after each use to preserve freshness and prevent oil rancidity; consume within 180 days.",,,,,,image.png (https://v5.airtableusercontent.com/v3/u/53/53/1780365600000/Ttm6nP9EdQYd0Aui5gKHAQ/FiEAiC3jIwMcUwAIZ3ig0E9M83hsghEF5S97GghyN7wWtAcNGF0PucHxI-PDM0WeWSWGIvw3saL2Cp_AM_h801GiP4lupZNcOBp5paLm8OsUxXvGjGHsgsbw0olnK4RIgSVLAd7qrpIrJiC1ElFKpw/ofoZ4T-JFVdZFL0RNvXsNPf6KrLTD-BW0Z-RD_PAnyk),0,
Spread Cheese,Cheeses & Dairy,"Raw milk,Garlic,Olives,Cumin,Oregano","Creamy spreadable cheese made from raw milk, blended with garlic, olives, cumin, and oregano for a bold, Mediterranean-inspired flavor perfect for any occasion.","Proteins 15%  
Lipids 55%  
Carbs 30%",15,55,30,"Energy: 320 kcal, Protein: 13 g, Carbohydrates: 4 g, Fat: 28 g, Fiber: 1 g, Calcium: 500 mg",Refrigerated,14,"Store refrigerated at or below 4°C and consume within 14 days; keep the cheese tightly sealed to prevent absorption of odors and maintain freshness, especially due to the use of raw milk and aromatic ingredients.",,,,,,image.png (https://v5.airtableusercontent.com/v3/u/53/53/1780365600000/i7vyyUI2BeRJiWgR2Bcl9Q/kldPZOIAYYcbia93uHSERm0YAYXU-qiEf6jFqpa8yTT5vWd3c5HjL_s6MwiAklSJiN6udxbZzrZlspgViUc1ak7Y1ox8-6WpMzrWH0YxSFCSA14oF-C_QpHSAQyireVHgjYyfI67HAae9xDt5PtzhQ/t4dS3IgioGNl6BidAsnFBGNVWr9UTxVIKBRABdUhJso),0,
Peanut Butter,Spreads & Nut Butters,"Peanuts,Argan/Olive/Sesame oil,Honey","Creamy peanut butter blended with your choice of argan, olive, or sesame oil and sweetened with honey for a rich, naturally delicious spread.","Proteins 25%
Lipids 50%
Carbs 25%",25,50,25,"Energy: 600 kcal, Protein: 22 g, Carbohydrates: 18 g, Fat: 50 g, Fiber: 6 g, Vitamin E: 7 mg",Room Temp,180,"Store in a cool, dry place away from direct sunlight and tightly seal after each use to prevent oil separation and preserve freshness for up to 180 days. Stir well before use if natural oil separation occurs.",,,,,,image.png (https://v5.airtableusercontent.com/v3/u/53/53/1780365600000/-RVXft8gMuntYR2jNyhURw/gtcuxmASMA8kT6aqLAj2pHFj6J4Z86apz4koVfiP9r9bpDV_goWdDA5xlg5DQpV_ynvUAVjYBqWbQ0oatsnkefWy_iRo2_u-DdxOScUtrl3cNdW_S7x402BmCwBU8T7BluJGsCNAEcTL3LzceyYeHw/_OfKQJOn9CLNFM-h05PYLIKtDX-cj5BFDlMvGTL3i-o),0,
Marinated Sardines,Fish & Seafood,"Sardines,Garlic,Fresh herbs,Lemon,Spices,Olive oil","Tender sardines marinated with garlic, fresh herbs, lemon, and spices in olive oil—bursting with Mediterranean flavor for a delicious, ready-to-enjoy treat.","Proteins 45%  
Lipids 50%  
Carbs 5%",45,50,5,"Energy: 210 kcal, Protein: 22 g, Carbohydrates: 0 g, Fat: 14 g, Fiber: 0 g, Calcium: 250 mg",Refrigerated,14,"Store refrigerated at or below 4°C and consume within 14 days; keep the container tightly sealed to prevent odor transfer and maintain freshness, especially for fish-based products with fresh herbs and olive oil.",,,,,,image.png (https://v5.airtableusercontent.com/v3/u/53/53/1780365600000/XuAUi2sRRLc8xLhkxo_VBA/3xGZz-X3ihBS5AgdKpHWtxmk2uyGOJU5kaqAMjzXXthq8yglUbO0UFac0L46w53LC_98uu9gZHjW3ccMzthyU04i-ud2ua32OGM2kgUVFQKG_45cwKyHBSw55WgHTvxh3IsucIFQsik9tmj-U_G7jA/ntW-oT8lDrio5YcxPkUoJGQxuE5ltsSRM988gOCa7WI),0,
Béchamel Sauce,Sauces & Condiments,"Milk,Butter,Flour,Salt,Pepper,Spices","Creamy béchamel sauce made with fresh milk, butter, and spices—ideal for elevating pasta, lasagna, or vegetables with classic French flavor.","Proteins 10%  
Lipids 35%  
Carbs 55%",10,35,55,"Energy: 120 kcal, Protein: 3 g, Carbohydrates: 8 g, Fat: 8 g, Calcium: 110 mg",Room Temp,1,"Store in a cool, dry place and use within 1 day; keep covered to prevent contamination and spoilage, as dairy-based sauces are highly perishable at room temperature.",,,,,,image.png (https://v5.airtableusercontent.com/v3/u/53/53/1780365600000/ww6RmnpCoGhaa6hBtJ8i_w/v06Z0XMWZkQIU1EXACxubZ0fLo4eu29zNyO-5zqdEPFNMcyceGtv_OZ0nNTURUgfH98FFs6PKPosSOI5Um1DOoF_eLHKe_frdAuJSDLUfgLD2OxeC46ec0cHEk76eC2W_OER6W-e1DeDIYFqMF0AFQ/qN9G1K5MB9lQuG_bnHcdtYNmsXuL_YJxGOT1_aA7wKc),0,
Hard Cheese,Cheeses & Dairy,"Raw milk,Salt","Rich, flavorful hard cheese made from pure raw milk and salt—ideal for gourmet snacking, cheese boards, or enhancing your favorite recipes.","Proteins 25%  
Lipids 33%  
Carbs 2%",25,33,2,"Energy: 400 kcal, Protein: 25 g, Carbohydrates: 2 g, Fat: 33 g, Calcium: 800 mg",Refrigerated,180,"Store refrigerated at or below 4°C and keep the cheese tightly wrapped to prevent moisture loss and contamination; consume within 180 days, ensuring raw milk cheeses are handled with clean utensils to maintain safety and quality.",,,,,,image.png (https://v5.airtableusercontent.com/v3/u/53/53/1780365600000/TGsBDrwqVACRZPQQiH9RAA/MecU6svw-Z72kzzidObQcobZWt9-Tg2Iep-NAZPCMSmncMOvRYcE58gTrWReYtrpR1H-dcGWaJbzrpkxsckW2XPwo91OY9bsm7W6Z1eMJemkErwT2RUDA4d08btHBFbauLXhNbU0H9y3nF5cOk1sow/I79xhEQQNffP7B3qh7eJIZFYilL1IFj3dMDCPZoX6u4),0,
Marinated Tuna,Fish & Seafood,"Tuna,Garlic,Fresh herbs,Lemon,Spices,Olive oil","Tender tuna marinated with garlic, fresh herbs, lemon, and spices in olive oil—bursting with Mediterranean flavor for a delicious, ready-to-enjoy meal or snack.","Proteins 60%  
Lipids 30%  
Carbs 10%",60,30,10,"Energy: 180 kcal, Protein: 23 g, Carbohydrates: 1 g, Fat: 9 g, Fiber: 0.5 g, Iron: 1.2 mg",Refrigerated,14,Store refrigerated at or below 4°C and consume within 14 days; keep the container tightly sealed to prevent odor transfer and maintain the quality of the tuna and fresh herbs.,,,,,,image.png (https://v5.airtableusercontent.com/v3/u/53/53/1780365600000/utT3XDreaaJqFqXVtLjHWQ/tFthk_iwd247gvFqlfwzWJARDZatliBOOsmIxGe7gZbBs2hySooVa-I9VdaXnWEwHL71Evx9rOZw6vppWumKiGSvFzcPpKKuNCDcCyxpOURXurN9s1EUImvam9W4XDlgT1fFFM_jiSUOQ_rqay467g/zXS4q9-GfOtHR7uO4k79KiSLeyMTpGTl7x2P97mqow4),0,
Leben,Fermented Beverages,"Raw milk,Milk kefir","Creamy Leben made from raw milk and live kefir cultures—rich in probiotics for a tangy, wholesome boost to your daily nutrition.","Proteins 30%
Lipids 30%
Carbs 40%",30,30,40,"Energy: 65 kcal, Protein: 3.3 g, Carbohydrates: 4.7 g, Fat: 3.6 g, Calcium: 120 mg, Beneficial bacteria: ~1x10^8 CFU",Refrigerated,14,Store refrigerated at or below 4°C and consume within 14 days; keep the container tightly sealed to preserve the quality and probiotic content of the raw milk kefir.,,,,,,image.png (https://v5.airtableusercontent.com/v3/u/53/53/1780365600000/H_T17y_CDGUd73A2rVOH0Q/ULJmNpTSA0egVTsV1TKxZgMluJgfdrfGhFeAF_-fvKpgTum2K5CYDMUE07zUMd5we1Yfd2vI-skaAtnSqecjTnHeEVs_1qByks_79hqF9PBm_J0LPsbCArQch7BsBw-I8TZDJ2A3we2p_y4RZ0xGQg/5K7wnTxULTYoQ38cBXXMHeSgOz2ntVap4Ih_YpRZwYA),0,
Sardine Kefta in Tomato Sauce,Fish & Seafood,"Sardines,Garlic,Fresh parsley,Spices,Lemon,Tomato sauce","Tender sardine kefta blended with garlic, fresh parsley, and spices in zesty tomato sauce—an authentic, flavorful twist on classic Mediterranean cuisine.","Proteins 35%  
Lipids 30%  
Carbs 35%",35,30,35,"Energy: 160 kcal, Protein: 15 g, Carbohydrates: 4 g, Fat: 9 g, Fiber: 1 g, Calcium: 250 mg",Refrigerated,7,Store refrigerated at or below 4°C and consume within 7 days; keep the container tightly sealed to prevent odor transfer and maintain freshness of the sardines and accompanying ingredients.,,,,,,image.png (https://v5.airtableusercontent.com/v3/u/53/53/1780365600000/qCANRX-DuxWRRdayW_Pkww/GNCor7qxiyn9ZHDs0SkRydzUeH3T67NMtvoNdFMjUjB4_0zlgU5TnB9i3z7lXTWnWFuoByfh8cIbZ6xwnZDGP_i3zyMe8WqGRV3JHRY4JCd8USOmux4DWT2jyBLy3eNQ-b647Bj751Uq_bUQx448yA/R8yGH-aAFCQE5qbzM1mm99K0XBSRpM2LBtzEN-8YveY),0,
Bolognese Sauce,Sauces & Condiments,"Tomatoes,Ground beef,Garlic,Onion,Parsley,Bay leaf,Salt,Spices,Olive oil","Rich, savory Bolognese sauce made with ripe tomatoes, ground beef, and aromatic herbs—perfect for elevating your favorite pasta dishes.","Proteins 15%  
Lipids 25%  
Carbs 60%",15,25,60,"Energy: 110 kcal, Protein: 5 g, Carbohydrates: 7 g, Fat: 6 g, Fiber: 2 g, Iron: 1.2 mg",Room Temp,1,"Store in a cool, dry place and consume within 24 hours; keep covered to prevent contamination and discard any leftovers after one day to ensure safety.",,,,,,image.png (https://v5.airtableusercontent.com/v3/u/53/53/1780365600000/GDeDsHiUW-fZBaoqWPKoPQ/azcS96vaUcFIp9SZL_ia1f_wavOK4I0huX0DuQjJBF0lpQXVruQGAq1M0h-SGUK5W0OdYwrB4CQzfE32jPC3DQBEuj-Ndbd22c4HP6GkN8r3tCIMMxv6Z4iDn9B7YjJP8TqLEMCWUwrYJpM955F_bw/Tpf5F13EValjVw-TvN9NWhb8LxFUxuWP5irwnByL9Fg),0,
Jben,Cheeses & Dairy,"Raw milk,Salt","Creamy Moroccan Jben cheese made from pure raw milk and a touch of salt—delightfully mild, perfect for spreading, snacking, or adding to your favorite dishes.","Proteins 25%  
Lipids 25%  
Carbs 50%",25,25,50,"Energy: 220 kcal, Protein: 14 g, Carbohydrates: 3 g, Fat: 16 g, Calcium: 400 mg",Refrigerated,7,"Store refrigerated at or below 4°C and consume within 7 days; keep cheese tightly wrapped to prevent moisture loss and cross-contamination, especially since it is made from raw milk.",,,,,,image.png (https://v5.airtableusercontent.com/v3/u/53/53/1780365600000/uzuu1OJu7DKtR94pR3mGkA/cGb4UXn18UFo9cIucBNPcFmcIrROk-7j6D6JiIGPj3qYLnrzccVrF_9Tj1iLihuGLDkGSGzwRuxYLXRucX8dMkw_rdj99o7G_nzAt1v4o2NxYNZuZJfKCPjKajYNjWixrXYBoXc-TitRtiV2XVL0fw/ME3f1fUy5U6KdS_pG0QZO707HSapZF4XoOyemVHd4-k),0,
Milk Kefir,Fermented Beverages,"Kefir SCOBY,Raw milk","Creamy, probiotic-rich milk kefir made from raw milk and live cultures—supporting gut health with a tangy, refreshing taste.","Proteins 20%  
Lipids 25%  
Carbs 55%",20,25,55,"Energy: 65 kcal, Protein: 3.3 g, Carbohydrates: 4.5 g, Fat: 3.6 g, Calcium: 120 mg, Probiotic bacteria: ~1x10^9 CFU",Refrigerated,14,Store refrigerated at or below 4°C and consume within 14 days; keep the container tightly sealed to preserve the quality of the raw milk kefir and prevent contamination.,,,,,,image.png (https://v5.airtableusercontent.com/v3/u/53/53/1780365600000/4y9CY_Nh5yn2IbxTd--61g/Qun48zutp0YfIoH3NzJrfBLA8KArgEzWI4J6JpjUbObc1IeqEMfDw6HbFVEzFCo2ech1rZGXdK63ctcV4kV1PvblbKSwB7olnZyR3IbbJzUHTXkdKbSN2nLR5xLV4j7bm0ptKb2ChmOVumVs1V0c4w/1gZEIt25zqQTb_kYRRAh0KGU2vCDx3vhtRjRYl_iDNs),0,
Marinated Anchovies,Fish & Seafood,"Anchovies,Garlic,Fresh herbs,Lemon,Spices,Olive oil","Tender anchovies marinated with garlic, fresh herbs, lemon, and spices in olive oil for a zesty, Mediterranean-inspired flavor perfect for appetizers or salads.","Proteins 25%  
Lipids 20%  
Carbs 55%",25,20,55,"Energy: 210 kcal, Protein: 18 g, Carbohydrates: 1 g, Fat: 15 g, Fiber: 0 g, Sodium: 1500 mg",Refrigerated,14,"Store refrigerated at or below 4°C and consume within 14 days; keep the container tightly sealed to prevent odor transfer and maintain freshness, especially for fish-based products with fresh herbs and olive oil.",,,,,,image.png (https://v5.airtableusercontent.com/v3/u/53/53/1780365600000/MXeby92IAk1oMGuZg2SJRw/DCNDT-hLL1LE0yp__1yKrNyTejrMhqG5kItEsov-UtuJhaYs09tBxKDmqiGz6ze3cm3JeEB-EGiLGtIsBS8HJi27iHB8Fj6m6sJCnKOem0PtOPjYC7esTZX9GjGBlcHGXPG8UgJh8DILUU_NPwEoiA/wQLnjCpnK5tt0-x2p4q1QDQCg2V_G8OSYzuWHOMC7XA),0,
Whiting Kefta in Tomato Sauce,Fish & Seafood,"Whiting,Garlic,Fresh parsley,Spices,Lemon,Tomato sauce","Tender whiting blended with garlic, parsley, and spices, simmered in zesty tomato sauce for a flavorful, Mediterranean-inspired meal.","Proteins 30%  
Lipids 20%  
Carbs 50%",30,20,50,"Energy: 110 kcal, Protein: 13 g, Carbohydrates: 5 g, Fat: 4 g, Fiber: 1 g, Vitamin C: 10 mg",Refrigerated,7,Store refrigerated at or below 4°C and consume within 7 days; keep the container tightly sealed to prevent odor transfer and maintain the freshness of the fish and herbs.,,,,,,image.png (https://v5.airtableusercontent.com/v3/u/53/53/1780365600000/nECLAHVijrNUqLpw7DdrKQ/K243hp1NkiQ-ORIOwkDbakJnjN7Z_nMIsJLglwCMpRXlzmGYOtdXErOrWC6pwJBtJYPdBlrHI3VfWi7W6pMrgwlqlOUxVU0J7BDJUJqvrf-rgBkCjAcbyPZ1KqeSW_mli1hJRQUC0c0bZjPm-aDyXA/OYreTJO-m9f-SboZGRi_rp5A981UpgATyMgh8MGa98U),0,
Marinated Octopus,Fish & Seafood,"Octopus,Garlic,Fresh herbs,Lemon,Spices,Olive oil","Tender octopus marinated with garlic, fresh herbs, lemon, and spices in olive oil—bursting with Mediterranean flavor for a gourmet appetizer or salad.","Proteins 25%  
Lipids 10%  
Carbs 65%",25,10,65,"Energy: 120 kcal, Protein: 16 g, Carbohydrates: 2 g, Fat: 5 g, Fiber: 0.5 g, Iron: 4 mg",Refrigerated,14,Store refrigerated at or below 4°C and consume within 14 days; keep the octopus dish tightly sealed to prevent odor transfer and maintain freshness. Ensure the container is non-reactive to preserve the quality of the olive oil and herbs.,,,,,,image.png (https://v5.airtableusercontent.com/v3/u/53/53/1780365600000/Sy53EuZMPNyWXId7cNnNEQ/9yydHDQDKQdpmRtHBbuN4qD75aUU4TQ9m16V9qNXe87-xuU6HXOpi7OGm2G84VAlJxxnxDwMjegRDe8A101vRN2yZoD-BV29whVlNW0xMP3Wm67e9HIKKTG17zyjp2TFxe4otG4Z4BZwKykHf069gg/dSClNQvrc5QHQH_xZMriKFcplpiQrtmbFCMKN4zyLaA),0,
Marinated Eggplants,Fermented Vegetables,"Eggplants,Salt,Garlic,Fresh parsley,Fresh coriander,Spices,Bay leaf,Water,Olive oil","Tender eggplants marinated with garlic, fresh herbs, and aromatic spices in olive oil for a savory, Mediterranean-inspired appetizer or side dish.","Proteins 3%  
Lipids 10%  
Carbs 87%",3,10,87,"Energy: 110 kcal, Protein: 1.2 g, Carbohydrates: 5 g, Fat: 8 g, Fiber: 3 g, Potassium: 200 mg",Room Temp,90,"Store in a cool, dry place away from direct sunlight and ensure the container is tightly sealed; for fermented vegetables, monitor for signs of spoilage and consume within 90 days for optimal safety and quality.",,,,,,image.png (https://v5.airtableusercontent.com/v3/u/53/53/1780365600000/JJ3doreCdMIl-p-AhOqwbQ/EC3CdlyXaiJMry7Y90dgir5FCG9F75gZI6TefLIcDrn7c4Q7Ull_KvGZFZm2ODR8K6yPpilH1g29iDcXOVsiiEl_su95Nah4Lqw6glz3RUXQVYBR8p1IUCaxQ_O6UjG8kScf_g3fvOMGsxT0n_VhsA/9qML3Fe0QBukpVKr6kM_WAVvMbQZUgRnmcMK3swe5P4),0,
Wholegrain Mustard,Sauces & Condiments,"Mustard seeds,Water,Salt","Robust wholegrain mustard made with simple, natural ingredients—perfect for adding bold, tangy flavor and texture to sandwiches, dressings, and marinades.","Proteins 7%  
Lipids 8%  
Carbs 85%",7,8,85,"Energy: 120 kcal, Protein: 6 g, Carbohydrates: 8 g, Fat: 7 g, Fiber: 5 g, Iron: 1.5 mg",Room Temp,365,"Store tightly sealed in a cool, dry place away from direct sunlight, and ensure the container is closed after each use to maintain quality throughout the year.",,,,,,image.png (https://v5.airtableusercontent.com/v3/u/53/53/1780365600000/d1XigKgwq_pgIIS6WOPPJQ/HrYZcUYCLU3puRa6zZc2l8k8MJ4zQ1rZF6MmcUqdn093IZaD2Xb872E6Igbu6_Ioanotlb_rfQ6jyp9jFCjb0o6DS8X9QD9vBIYCIBJdLsmwemWmisof9cQRPcpcUyTnwwsH6QHjmx7PoKk10OXoyw/GOwd1toNcVwJcQhaCFM8pV5D02y5qs5K1zhrbNxKKuA),0,
Sun-Dried Tomatoes,Jams & Fruit Products,"Tomatoes,Water,Vinegar,Olive oil,Garlic,Spices","Rich, tangy sun-dried tomatoes marinated in olive oil, garlic, and spices—ideal for adding bold Mediterranean flavor to salads, pastas, and appetizers.","Proteins 14%  
Lipids 7%  
Carbs 79%",14,7,79,"Energy: 180 kcal, Protein: 4 g, Carbohydrates: 30 g, Fat: 6 g, Fiber: 7 g, Potassium: 1100 mg",Room Temp,180,"Store in a cool, dry place away from direct sunlight and heat sources; ensure the container is tightly sealed to maintain quality and prevent spoilage throughout the 180-day shelf life.",,,,,,image.png (https://v5.airtableusercontent.com/v3/u/53/53/1780365600000/o24DjGL0gQ19Y9WZvTc_tw/j-dvo8E9Vu9tLCOtpGeK_gjOCiHo7wIQyuzn_2iof-b91MpTu4XS9quhtDcb6BTSPvWmxqNWAzofWF0O4m864IqjJJlohrocAik0OUTXWlIJCiqVY6Zk47e8ip_DdpM76xPzUuYtH6MTHfRYXGGF3w/ZcEkjIEuYU6_3vlEH5PqxVeZpZigsMHzyxdNqIHTMm8),0,
Tomato Sauce,Sauces & Condiments,"Tomatoes,Garlic,Onion,Parsley,Bay leaf,Salt,Spices,Olive oil","Rich, savory tomato sauce made with ripe tomatoes, aromatic garlic, herbs, and olive oil—ideal for elevating pasta, pizza, or your favorite recipes.","Proteins 5%  
Lipids 5%  
Carbs 90%",5,5,90,"Energy: 60 kcal, Protein: 1.5 g, Carbohydrates: 7 g, Fat: 2.5 g, Fiber: 1.5 g, Vitamin C: 12 mg",Room Temp,365,"Store in a cool, dry place away from direct sunlight and ensure the container is tightly sealed; use a clean utensil each time to prevent contamination and maintain quality throughout the year.",,,,,,image.png (https://v5.airtableusercontent.com/v3/u/53/53/1780365600000/uqHm87_olC5odUjOw0awJw/LpmYPZvS3TVNn4o4zQacAkCQki08LVZbf_Z6ZUxbwx2VvX9tTlvFb5JXjjVImvb7BeNielpxEvEauB36BLxOxvWhx_FwJ8RLIyhDXiJn6yxJD5AHypeUhd23HIzKf7Sz8J12yr4AvcrLKCsGbVkykw/aOKHYT7G0YTWHE713qk4kCe-DnMoiKKnIC1nQuv-11w),0,
Seasonal Fermented Vegetables,Fermented Vegetables,"Cabbage,Carrots,Beets,Water,Garlic,Ginger,Onion,Fresh turmeric,Salt,Pepper,Bay leaf,Honey,Coriander seeds,Mustard seeds","A vibrant mix of fermented cabbage, carrots, and beets with aromatic spices—rich in probiotics for a tangy, gut-healthy boost to any meal.","Proteins 5%  
Lipids 2%  
Carbs 93%",5,2,93,"Energy: 40 kcal, Protein: 1.2 g, Carbohydrates: 8 g, Fat: 0.3 g, Fiber: 2.5 g, Vitamin C: 18 mg, Beneficial bacteria (Lactobacillus): present",Room Temp,180,"Store in a cool, dry place away from direct sunlight and ensure the container is tightly sealed; for fermented vegetables, monitor for signs of spoilage and consume within 180 days for optimal quality.",,,,,,P1010388.jpg (https://v5.airtableusercontent.com/v3/u/53/53/1780365600000/c5o-PUHjjEuZU-j3UyEJhA/WHqqEgTI4cbf1rggYzSPhhsDQgmRWkHyftIP3ph9XC5I3fW2GtnBFdyjV7zuqOlDrhGeWxPK9BgGweLSNZvovzgiSyFjgsTvZMq-WzUjkEVOJudo_M7wtmwduwA5iIch_oo4y6qgX0vQSw74n8snmkfgtS2lR-Q4AOPbIU4Ar8s/14yYPxN7Ku55omnFrDGdtWB24_JmzCRlPtq6D3EcQfY),0,
Jams,Jams & Fruit Products,"Seasonal fruits,Brown cane sugar","Handcrafted jams made with ripe seasonal fruits and brown cane sugar for a naturally sweet, vibrant spread perfect for breakfast or desserts.","Proteins 1%  
Lipids 0%  
Carbs 99%",1,0,99,"Energy: 260 kcal, Protein: 0.5 g, Carbohydrates: 65 g, Fat: 0.2 g, Fiber: 1.5 g, Vitamin C: 8 mg",Room Temp,180,"Store in a cool, dry place away from direct sunlight and tightly seal after each use to preserve quality for up to 180 days. Ensure containers are clean and dry before resealing to prevent moisture and spoilage.",,,,,,image.png (https://v5.airtableusercontent.com/v3/u/53/53/1780365600000/pWXqPcQAzaL1HoAN4h56fg/FzhpeZGhSKH8SsGeNSuXhJegf3jRkY8qLuh3j91aKy59l-rozvSwmjRvQ4CoVT8esYc7oZ17XhSmk1MOvIQr6jOzS2IMa0EsBNELnv81MTLEi6875uLCeqoM5qif9_Xgebd2N1UsJqhtjWlhxmnsfA/snwyliLjlJdJI54_R-R0Li-7Sj_zf-3yohjvIN1k1hs),0,
Ginger Beer,Fermented Beverages,"Ginger,Sugar,Water,Lemon","Zesty ginger beer crafted with real ginger, lemon, and pure cane sugar for a refreshing, naturally bold taste—perfect for sipping or mixing.","Proteins 0%  
Lipids 0%  
Carbs 100%",0,0,100,"Energy: 180 kcal, Protein: 0.2 g, Carbohydrates: 44 g, Fat: 0 g, Fiber: 0.2 g, Vitamin C: 8 mg",Refrigerated,30,Store refrigerated at or below 4°C and keep the container tightly sealed; consume within 30 days to maintain optimal flavor and prevent spoilage of this fermented beverage.,,,,,,image.png (https://v5.airtableusercontent.com/v3/u/53/53/1780365600000/6JzLGTlCZr-jJUjdtl1cTA/vRfdh1oZE7l1p2HGIaXfGuZqq3nbuMM2HiM0MMtUqQeIRSLegf4Y16UmjYqEMuznowk4U48ib9UvfGhIQzmlo9xXJ7b1olEA-Kgm9AFeJJOexEv9C0X7KyUCIcsWZQrN4Yn2mgiO9Uqcia4c65-VTg/2L1vOmvUG6rkUcLUtWhDJsc-DyCYTZzwonRYMX0lCxo),0,
Water Kefir,Fermented Beverages,"Kefir SCOBY,Water,Sugar,Lemon,Figs,Seasonal fruits and herbs","Naturally fermented water kefir with lemon, figs, and seasonal fruits—refreshingly tangy, probiotic-rich, and crafted for a deliciously healthy boost.","Proteins 1%  
Lipids 0%  
Carbs 99%",1,0,99,"Energy: 30 kcal, Protein: 0.2 g, Carbohydrates: 7 g, Fat: 0 g, Fiber: 0.2 g, Vitamin C: 4 mg",Room Temp,7,"Store in a cool, dry place away from direct sunlight and consume within 7 days; keep the container sealed to maintain carbonation and prevent contamination in this naturally fermented beverage.",,,,,,image.png (https://v5.airtableusercontent.com/v3/u/53/53/1780365600000/1x1pgQk0Gy1nh5n_sFCaPQ/SREvD-P05NcBI6w97OI6sXUbU3ohuZT9YmfUh_MWqq_mmw9pqQ4a2lcOXVZQMwbdLhqNVDzG8t5bSU_wp10x4ghylMzZBhAuuZy3N28vaGNnEzfV8tMOjNvAkuey_YJ-lKHUUk71JGDadHWyDMiOpg/tjPCl_zJOQHjsgRrrScFoOjAlQBgh2vuZmx4tBJfXew),0,
Kombucha,Fermented Beverages,"Black Tea,Water,Sugar,Seasonal fruits","Refreshing kombucha brewed with black tea, sugar, and seasonal fruits—naturally fermented for a tangy, probiotic-rich drink that supports gut health.","Proteins 0%  
Lipids 0%  
Carbs 100%",0,0,100,"Energy: 18 kcal, Protein: 0 g, Carbohydrates: 4.5 g, Fat: 0 g, Fiber: 0 g, Vitamin C: 2 mg",Room Temp,90,"Store in a cool, dry place away from direct sunlight and tightly seal after each use; for fermented beverages, ensure containers are airtight to prevent contamination and maintain quality throughout the 90-day shelf life.",,,,,,P1010326.JPG (https://v5.airtableusercontent.com/v3/u/53/53/1780365600000/i0NViFF642vLH5LshqYfdw/4SX5gfJG47MYiBv44kEyrVMMQ-IXL5HT14274bxtflHBfU82RZ-aL3fA4nccWBx-kFxZfdtquR9uMPisVJdcNoepTBgxT4T1ukuCTZGt3gQ6vzRCIttx8MhdDsmDCqUOgHf-L_KGw6gT4wTz2RCjTT8PTxozH17vwxyKKBoGG4k/yDVl1z0pDYPuRw7J1uwDXpq6zQj2EpRLfDE1H8Kuntg),0,
